comment,date,support_number,user
没关系，我就是故意泄漏的（图片来自迪拜七星级酒店vvip海景房）,今天 14:25 来自网页,13984,今天的晚安呢
专家多虑了,今天 15:21 来自网页,10711,每日沙雕gif
在中国，所有用户都要乖乖同意APP获取隐私才能用，以前不用的，不知道为什么现在都是强制的了。,今天 14:43 来自网页,6108,张_小_尘
早没了好嘛~拒绝获取地理信息就给劳资滚，什么时候同意了什么时候再来,2分钟前 来自网页    ,0,绿竹叶素
关键是我发了位置也没人要看,2分钟前 来自网页    ,0,轻风拂过happy
谁会这么用心去查这些啊,2分钟前 来自网页    ,0,病是晓雙
谁会发原图哈哈哈,4分钟前 来自网页    ,1,我姓仙叫仙女8
关键有的时候不发原图做出来东西不清楚呀,4分钟前 来自网页    ,0,咪路殿下·
在闲鱼买东西被诱惑到第三方支付，聊天记录都在，请问一下大家怎么维权,5分钟前 来自网页    ,0,秀儿姐姐哟
原来我们还有隐私？感谢砖家,7分钟前 来自网页    ,0,有趣的零珲
微博黑微信，哈哈哈,7分钟前 来自网页    ,0,look少年
我的信息从未得到保障，我还怕多个途径泄露吗？,7分钟前 来自网页    ,0,7号足球少年-L
泄漏又如何，我特么想让人知道我在哪儿的时候，就最好人家知道。不想的时候，我连照片都不会拍,8分钟前 来自网页    ,0,-XxxxF-
泄漏又如何，我特么想让人知道我在哪儿的时候，就最好人家知道。不想的时候，我连照片都不会拍,8分钟前 来自网页    ,0,-XxxxF-
我们还有自己的隐私吗,8分钟前 来自网页    ,0,IWPG不二
哦豁，不过无所谓啦,8分钟前 来自网页    ,0,_Angela_NG516
其实不管用什么发原图都会暴露地址信息呀，微博你上传没处理过的原图保存后也可以看到,8分钟前 来自网页    ,0,正在学习发光的小星星yooooo
我的位置澳大利亚新开的水家酒店，就是那个，人在做鱼在看的那个酒店,8分钟前 来自网页    ,0,Chencuired
找吧 ,8分钟前 来自网页    ,0,徐浩文-
都是小人物，泄漏了位置也不会有人搭理我,8分钟前 来自网页    ,0,吃什么肉H
找吧 ,8分钟前 来自网页    ,0,徐浩文-
都是小人物，泄漏了位置也不会有人搭理我,9分钟前 来自网页    ,0,吃什么肉H
知道了能怎么滴 我的朋友都知道我在哪,9分钟前 来自网页    ,0,shannuann
有的人朋友圈就是喜欢发位置和原图啊,9分钟前 来自网页    ,0,没有玩了1111
这个我有感触！一天我给一个人发一个东西，因为当时渣像素我怕看不清就发了原图。后来那个人见到我直接一句我知道你家在哪儿了真是吓我一跳,10分钟前 来自网页    ,0,智秀是仙女
微信拍泄漏么,10分钟前 来自网页    ,0,高雅依然要高雅
实在不知道自己有啥隐私,11分钟前 来自网页    ,0,杉颉宝宝冲鸭
拍摄的时候设置里位置信息去掉就行了,12分钟前 来自网页    ,0,DreamlightZhang
当今时代还有什么隐私可言？,12分钟前 来自网页    ,0,艺圃匠心
没事正等多几个冤大头来结账,12分钟前 来自网页    ,0,天天碰到奇葩
这个取决于你的手机相机 苹果一般默认拍摄带位置 可以关闭权限 安卓相机也可以设置照片是否添加 位置信息 相同的qq也有类似问题 关键在于你手机的相机,13分钟前 来自网页    ,0,长吟就会太平
那已经ps过的图片呢？？？？？？？？？？？？,13分钟前 来自网页    ,0,拆心chai
这个年代还有什么私密的信息吗，哈哈哈,14分钟前 来自网页    ,0,云淡风轻不谈情L
你tmd这三点也太容易满足了，你在说nm呢,14分钟前 来自网页    ,0,See_U_agAin__
一般值得我发原图的都知道我位置信息，而且我想了想真没啥东西可发,14分钟前 来自网页    ,0,Zzzzzkk
哈哈  除了122斤的体重已经没有值钱的东西了,16分钟前 来自网页    ,0,有事明天讲
这么恐怖的吗,16分钟前 来自网页    ,0,一颗绿色糖
口袋就几毛钱，泄露不泄露位置都一样,17分钟前 来自网页    ,0,是不是很傻丶
安卓吗？,19分钟前 来自网页    ,0,L明明明明明明明
哈哈哈哈哈哈我的手机相机一直都是设置拍照不记录拍摄位置！！！,20分钟前 来自网页    ,0,你的脸好好看
确实是会，原图的照片可以看到经纬度，也就是你拍照是的定位，但是如果这个照片你是在上海拍的，GPS是定位在上海，这时候你在别的城市发这个照片的时候也只会显示在上海罢了,20分钟前 来自网页    ,0,范家的陳小妹
为什么我看别人的图片，下载原图的话能看到尺寸大小，但是就是看不见它的位置啊！？,20分钟前 来自网页    ,0,瘦下来
有些人就是故意要暴露的怎么办？,22分钟前 来自网页    ,0,小脑袋v
无所谓了，我就算是发个960帧的他们都知道我在哪,22分钟前 来自网页    ,0,68小雨滴
无所谓了，我就算是发个960帧的他们都知道我在哪,22分钟前 来自网页    ,0,68小雨滴
微博也是吧，我发微博都没定位，偶尔会有同城的人看到评论,24分钟前 来自网页    ,0,Chanchanccc
建筑类证书资质办理，挂靠,24分钟前 来自网页    ,0,建筑类证书资质办理挂靠
手机号都被运营商泄露了。泄露个地址怎么了,24分钟前 来自网页    ,0,佛系本佛木木
心累啊,24分钟前 来自网页    ,0,许一个夏Summer
无所谓了……,25分钟前 来自网页    ,0,松闻
我早都不介意了，我的个人信息已经泄露了,25分钟前 来自网页    ,0,165lyb
很早就使用这种方法找欠债的人了,25分钟前 来自网页    ,0,我愿意为你忘记我姓名_
……,25分钟前 来自网页    ,0,1fqy往失
我想知道咋从原图获取位置,25分钟前 来自网页    ,0,白糖玛奇朵
现在网络时代，我们都没有隐私了的。连身份证号都被曝光,25分钟前 来自网页    ,0,泡椒凤爪奥利奥
如果我说只要用手机就会暴露位置信息，发图片只是其中亿万分之一的情况，而且实时性很低。会被以泄露国家机密的罪名抓进去吗,26分钟前 来自网页    ,0,作者黎锦
 ,26分钟前 来自网页    ,0,抹茶大哥啊
阿我有朋友特地告诉我他知道我在那里拍的，时间地点手机像素，后面会关掉位置信息拍照，不过一般人应该不会看吧，我也很早试过毕竟女人是侦探,27分钟前 来自网页    ,0,南方似远方
给给给，只要不是我的支付密码。我的信息你要的全拿走,27分钟前 来自网页    ,1,原病魔早日战胜你
无所谓了,27分钟前 来自网页    ,0,能动手就20459
 知道了吗,27分钟前 来自网页    ,0,Wuuur_Chaih
不发位置我怎么炫耀啊,28分钟前 来自网页    ,0,carrie小凡子
隐私？网警分分钟秒了你,28分钟前 来自网页    ,0,我丶只说废话
还有什么没泄露的 只是泄露的广泛程度而已,28分钟前 来自网页    ,0,越洋海盗
怎么查看图片的位置的?求教,28分钟前 来自网页    ,0,瘦下来
没关系，我一没钱，二没色,28分钟前 来自网页    ,0,刘晓六
信息时代，该泄露的都泄露了，除非不用电子产品。,29分钟前 来自网页    ,0,书虫酆哥哥
 你看看,29分钟前 来自网页    ,0,蔬菜饼
放心吧 还要你原图的都是熟人 不熟的你也不发 而且显示的是拍摄地点 不是目前所在的地点,29分钟前 来自网页    ,0,家想夢大个一
放心吧 还要你原图的都是熟人 不熟的你也不发 而且显示的是拍摄地点 不是目前所在的地点,29分钟前 来自网页    ,0,家想夢大个一
发朋友圈就是要定位才有意思,29分钟前 来自网页    ,0,是錦鯉阿_
现在都是大数据时代，那还有隐私。。。,30分钟前 来自网页    ,0,delay-dl
好可怕，都透明化了，没有任何隐私了。,30分钟前 来自网页    ,0,beautiful--天空
有一种很成熟，成本也不高的技术叫“脑控”。根本不需要手机和监控，仅仅利用人体芯片就能准确定位你，那些被注射芯片的人，甚至好几年都不知道自己已经被注射了芯片......,30分钟前 来自网页    ,0,黑帮公子别在叫我太子
这不是几年前我初中的时候新闻就有说了吗……这炒冷饭还能炒到热搜顶,31分钟前 来自网页    ,0,我一出生就喜欢结衣了
早就知道了,31分钟前 来自网页    ,0,和千玺有一腿
图片评论 ,32分钟前 来自网页    ,0,Senna_zy
我早就知道了,32分钟前 来自网页    ,0,Juvenility丶
个人隐私泄露太严重了，我都想用老板诺基亚，确忽然发现我早已中了毒,33分钟前 来自网页    ,0,巨野哒哒后ba
个人隐私泄露太严重了，我都想用老板诺基亚，确忽然发现我早已中了毒,33分钟前 来自网页    ,0,巨野哒哒后ba
现在注册账号都要强制手机号。 还怕没隐私？ 一天被骚扰电话骚扰N遍 烦都烦死了,33分钟前 来自网页    ,0,凝恋_铭
我没开GPS，拍照之后都有定位地理位置时间地点,33分钟前 来自网页    ,0,薆lan
说得好像我们还有隐私似的,34分钟前 来自网页    ,0,Miss·Sunshine
微博也一样,34分钟前 来自网页    ,0,洛天然工作室
我手机只有用美团 看天气的时候才会打开位置 一直开着总觉得别人能跟踪到我,35分钟前 来自网页    ,0,·Expecto
，，，科普任重道远啊,35分钟前 来自网页    ,0,Night_watch_man
 第一次晓得,35分钟前 来自网页    ,0,Whateverxyh
泄露了能咋的？微信里都是认识的人，是不知道我住哪里还是去哪里玩？,36分钟前 来自网页    ,0,陈酒一斛
那加了滤镜什么的图片还算原图吗,37分钟前 来自网页    ,0,赵huan啊
我们比x光都透明。哪来的隐私？专家想多了。,37分钟前 来自网页    ,0,希望小树3130522327
这其实是为什么大多数女生喜欢用美颜的真正含义（不会泄漏位置呀,37分钟前 来自网页    ,0,骑上单车去西藏LX
我不太爱发原图，我总觉得不清晰,38分钟前 来自网页    ,0,鸢尾蔓青萝
被骗了申请微信介入能不能退款啊,39分钟前 来自网页    ,0,糖酒粥
不泄露我出去旅游了那我这个朋友圈就白发了  旅游也白旅游了,40分钟前 来自网页    ,0,廖廖廖廖燕
哇😭看到自己母校,40分钟前 来自网页    ,0,青石河畔的青少年
做坏事才怕泄露位置吧,41分钟前 来自网页    ,0,唐朝尚书令
同款鼠标,41分钟前 来自网页    ,0,xiaxia不能再吃了
这跟微信有什么关系...,42分钟前 来自网页    ,0,小马利亚的暮光闪闪
看看小璐跟皮几玩的图便宜有嘛？,42分钟前 来自网页    ,0,卖白菜的书生
啊  我竟然都满足  不过应该没人那么关心我,42分钟前 来自网页    ,0,陈晓蝶哇
我去玩迪士尼之后 微博各种给我推荐迪士尼乐园酒店,43分钟前 来自网页    ,0,-良辰未远
我去玩迪士尼之后 微博各种给我推荐迪士尼乐园酒店,43分钟前 来自网页    ,0,-良辰未远
拍照的时候不开定位就好了。,44分钟前 来自网页    ,0,可乐鬼吖
 熟悉不 上次的离奇事件,45分钟前 来自网页    ,0,珎廘oannnAh
这是不是提醒我们，万一有危险，先打开位置，再发个原图,45分钟前 来自网页    ,0,小陈儿6462574089
哈哈哈，三年前就知道了。,46分钟前 来自网页    ,0,白海棠海棠棠
害 相机原图也会呢,46分钟前 来自网页    ,0,-perfectlywrong-
早就知道了，不过一般也只有很熟的人我才会发原图呀,46分钟前 来自网页    ,0,蛋酱_W
？？不发不是有人也能通过黑科技看聊天记录,47分钟前 来自网页    ,0,小宁奇妙环游记a
想知道根据照片怎么看对方位置,47分钟前 来自网页    ,0,一串钻石项链
但我发照片都是要p一下的,48分钟前 来自网页    ,0,半夏轻如烟-
 ,48分钟前 来自网页    ,0,-Julissa-
原来微信能发原图的嘛,49分钟前 来自网页    ,0,三也九目
知道又咋滴，有人在乎我去哪吗,50分钟前 来自网页    ,0,檩九
就好像裸奔了，还在意没穿袜子一样,50分钟前 来自网页    ,0,柏yiyi
微信有隐私？笑话,50分钟前 来自网页    ,0,CD东东东
我摊牌了！我就是我，不一样的烟火！ 我都直接告诉我位置，重要的是没人看,50分钟前 来自网页    ,0,luo七七di
早就知道，而且我能修改这个。在北京拍的照片我能把位置信息改到美国去,50分钟前 来自网页    ,0,反正名字再长也是没有人看的
微信里面难道不都是熟人？根本不用顾虑这些的好吧，反倒是微博才应该注意保护好用户的隐私，发一张图就能知道位置的那种事情我希望不要再发生～,51分钟前 来自网页    ,0,佩西莱雅
啥叫原图,51分钟前 来自网页    ,0,九月心情说
微信里面难道不都是熟人？根本不用顾虑这些好吧，反倒是微博才应该注意保护好用户的隐私，发一张图就能知道位置的那种事情我希望不要再发生～,52分钟前 来自网页    ,0,佩西莱雅
谁会闲着没事，专门下个软件监督你去了哪里啊,52分钟前 来自网页    ,0,踏春枝
 ,52分钟前 来自网页    ,0,游永进的父亲
2017年就辟谣了，还在这里造谣呢？,53分钟前 来自网页    ,0,小易Richard
泄露吧！我想别人知道我在哪里！好请我吃饭呢！,54分钟前 来自网页    ,0,XP-BF
最好别用微信发原图！当心泄露你的位置信息,54分钟前 来自网页    ,0,闽荣医疗
这不就是摄影测量学吗？,55分钟前 来自网页    ,0,这届网友有点差
本来不会的，你发完视频都学会了……是不是故意教大家的,55分钟前 来自网页    ,2,电影大爷
还是QQ好用,55分钟前 来自网页    ,0,是草莓味的CC呀
啊,55分钟前 来自网页    ,0,娜琏的lovely
啊,55分钟前 来自网页    ,0,娜琏的lovely
连点赞的都没有，还会有人关心你的位置？不要想多了，你不重要。,56分钟前 来自网页    ,0,东京都的烟
这算什么暴漏隐私，隐私早都没了...,56分钟前 来自网页    ,0,下着雨_秋
？,56分钟前 来自网页    ,0,何辞丶
 你看，老是发原图,57分钟前 来自网页    ,0,Left_锦
还有什么隐私啊，哈哈,57分钟前 来自网页    ,0,abtapple
互联网时代大家都在裸奔,58分钟前 来自网页    ,0,巢小小帅
啊哦，三个条件全部满足，并且经常发原图,58分钟前 来自网页    ,0,章鱼小丸子呀lhh
这条热搜和高以翔遗体回台的新闻同步热，两三个小时过去了，它依旧在热榜，而以翔的热搜快降没了！大家都心知肚明，心塞！,58分钟前 来自网页    ,0,婷婷婷儿婷婷
最好别用微信发原图！当心泄露你的位置信息,今天 20:33 来自网页    ,0,禾岩农业
不会吧，真有这种弱智热搜？拍照的时候你是可以设置记不记录位置信息的好吗,今天 20:33 来自网页    ,1,决定祎辈子了
大家都是刚知道的吗。。。,今天 20:33 来自网页    ,0,ErxiatJan
位置有影响吗？来找我吧。我要发原图了。,今天 20:33 来自网页    ,0,东京都的烟
这不用专家解答也知道啊,今天 20:32 来自网页    ,0,江云云云
哪里还有隐私可言，后台盗用照片身份证号！简直不要脸！有监管部门么？监管部门不存在的，哪怕一夜成立的可能性也小的很！ ,今天 20:32 来自网页    ,0,AuScorpion
这不p图都不行了,今天 20:32 来自网页    ,0,女版陈奕迅
不是或泄露，我看过，真的已经泄露了,今天 20:32 来自网页    ,1,Juker日月明
我还有隐私吗？你们吃饱了就好好研究些有用的。,今天 20:31 来自网页    ,0,Baymax9608
这也行？,今天 20:31 来自网页    ,0,李姣莺
这么恐惧,今天 20:30 来自网页    ,0,鱼在心海处
 注意点,今天 20:30 来自网页    ,0,1橙子Baby
 ,今天 20:30 来自网页    ,0,柴家的小朋友嗷
我的大学,今天 20:29 来自网页    ,0,被害妄想症的董小姐_
有了网络，个人隐私没了,今天 20:29 来自网页    ,0,陈静-企鹅问保创始人
苹果手机怎么关闭,今天 20:29 来自网页    ,0,书情的微博
吓的我赶紧关闭位置信息,今天 20:29 来自网页    ,0,橘子可乐爱西瓜
？？,今天 20:28 来自网页    ,0,-阿冯如意
这个发现没必要吧,今天 20:28 来自网页    ,0,淡然处世除尽一切铅华
我家宝很早给我说过诶，突然他的形象更高大了,今天 20:28 来自网页    ,0,就酱1920
 ,今天 20:28 来自网页    ,0,明白人小昕
暴露就暴露吧，我妈对我很放心 ,今天 20:27 来自网页    ,0,夕阳下的光影2
泄露位置有啥？大街上那么多人都位置尽收眼底，能怎么样,今天 20:27 来自网页    ,0,尼玛的全蛋
准确的说，是以前的安卓,今天 20:27 来自网页    ,0,旧殇和殇
✓//,今天 20:27 来自网页    ,0,于猫咪宝贝
没关系，毕竟我也不发陌生人,今天 20:26 来自网页    ,0,你的高冷病友
普通人不会去查位置，别有用心的肯定会想办法查,今天 20:26 来自网页    ,0,这什么名
很早都可以能根据你图片，定位你人在哪了,今天 20:26 来自网页    ,0,我都失眠了
最好别用微信发原图！当心泄露你的位置信息,今天 20:25 来自网页    ,0,龙宁自动化设备
最好别用微信发原图！当心泄露你的位置信息,今天 20:25 来自网页    ,0,龙宁自动化设备
我也是故意泄露的。分享,今天 20:25 来自网页    ,0,沉迷学术小仙女
我们有隐私吗？,今天 20:25 来自网页    ,0,Oihan-wl
罪犯又 抓不到，不是仍然逍遥法外,今天 20:25 来自网页    ,0,风扬起了灰尘
好像我是一直知道的？,今天 20:25 来自网页    ,0,JAY_李泳谊
 以后我不发原图了,今天 20:25 来自网页    ,0,Lightlasaber
任何app你不点同意隐私条款根本就用不了。点击拒绝后直接就闪退了。,今天 20:25 来自网页    ,0,Vodka明
微博也会啊 没有定位 但在同城也会刷到你 可能是手机定位了吧,今天 20:24 来自网页    ,0,LIN-大皮
发原图会泄露？幸好，我P图了,今天 20:24 来自网页    ,0,喜欢程姐姐
我口袋没半毛钱，花呗一大堆没还，泄露就泄露吧！泄露了给我还花呗吗？,今天 20:24 来自网页    ,0,飯飯那一年
这个早就知道了啊 不管微信还是其他时间软件 发手机原图 都会有地理位置显示的,今天 20:23 来自网页    ,1,小可艾啊
用各种美图软件美图后，应该不会了吧,今天 20:23 来自网页    ,0,我的一切与你you关
刚刚点了一个外卖，外卖员不止知道我地址，还知道我电话，还知道我长什么样,今天 20:23 来自网页    ,0,竹青37095
口怕。还好我从不开定位,今天 20:23 来自网页    ,0,珠宝名奢折扣购
信息早就泄露出去了，还怕这丢丢么,今天 20:22 来自网页    ,0,乂小王子
所以dd给gg发自己的写真原图是为了。。。别问。问就是,今天 20:22 来自网页    ,0,唯祖国信仰而不可辜负
微博发原图会吗,今天 20:22 来自网页    ,1,锦鲤也努力
最好别用微信发原图！当心泄露你的位置信息,今天 20:21 来自网页    ,0,禾岩满庭香
 其实一开始抢救及时，没有错过黄金四分钟，大家也不会这么愤愤不平。更何况附近就有AED除颤机，可能最后人不一定能抢救回来，但是救了我也没这么耿耿于怀！所以你们zj卫视为什么置人生命安全于不顾！！,今天 20:21 来自网页    ,0,慜慜z
专家伙食太好了,今天 20:21 来自网页    ,0,马儿沃尤尼窝斯
我要是在QQ群保存别人拍的照片，我都能知道地址....,今天 20:20 来自网页    ,0,安卟安卟
 到这种地步了吗,今天 20:20 来自网页    ,0,柳色烟烟
这有啥大惊小怪！,今天 20:19 来自网页    ,0,幽静森林里的精灵
大家才知道嘛？,今天 20:19 来自网页    ,0,聽风与妳_
我不但要发原图 我还要定位,今天 20:19 来自网页    ,0,嗨翘胡
微博也是啊，所以要记得关闭这个功能,今天 20:19 来自网页    ,0,-Fuga
江海大,今天 20:19 来自网页    ,0,MysunshineKrystal
装逼照不是原图差评，PS：隐私是什么？,今天 20:18 来自网页    ,0,jianhaol
这个不早该知道了吗,今天 20:18 来自网页    ,0,蒙奇·G·路虎
不不   没隐私   没钱 没人看,今天 20:18 来自网页    ,0,勤奋的大脸妹
我以为你们都是托 直到我自己点进去看了一下 果然是托,今天 20:18 来自网页    ,0,云深不知喵_
在？闭肛！有被冒犯到,今天 20:18 来自网页    ,4,花江秋子
如果是这样，我突然觉得这个世界上有人在乎我了,今天 20:17 来自网页    ,0,虞姬Mis
原图不是上传到云端数据库，保存在redis里么……独立的ip哇,今天 20:17 来自网页    ,0,能否卖我一杯忘情水或后悔药
你以为你是特朗普啊，还怕泄露位置,今天 20:17 来自网页    ,0,回忆总是甜_
吓得我赶紧发张图片定测位置,今天 20:16 来自网页    ,0,注册营养师_陈然
难道还有人给陌生人发原图,今天 20:15 来自网页    ,0,人人都叫我番茄丶
就是说 微信里给别人发个照片、它就能知道我的位置 是这么理解吗？求各位大神解答,今天 20:15 来自网页    ,0,keke运动
我想说我在哪重要么，他知道我在哪又如何？,今天 20:15 来自网页    ,0,零01976
 我丢,今天 20:13 来自网页    ,0,还我甜甜拳
 看我们学校,今天 20:13 来自网页    ,0,一条寻找梦想的咸鱼_Soit
最好别用微信发原图！当心泄露你的位置信息,今天 20:12 来自网页    ,0,商帮丝路
 不要让我发原图,今天 20:12 来自网页    ,0,关节熊·
现在还有个人隐私可言？,今天 20:12 来自网页    ,0,ChristinaBaby90
我拍个文件发原图难道发个马赛克图片领导不得捶死我,今天 20:11 来自网页    ,0,羊城往事
微信本来就被监控了，早就没隐私了,今天 20:11 来自网页    ,0,正在输入7011763278
隐私谁还往外发,今天 20:09 来自网页    ,0,一口獠牙的小豆豆
早知道了 淘宝的原图就是,今天 20:09 来自网页    ,0,荷东记忆
可我有时候就是想让别人知道我在哪😂,今天 20:09 来自网页    ,0,勿忘257
哪有什么隐私,今天 20:09 来自网页    ,1,一口獠牙的小豆豆
大数据时代真的无隐私啊,今天 20:09 来自网页    ,0,你今天早睡了吗zzZ
这也能上热搜？微博原图也一样啊，而且你保存了别人在法国的照片，发微博自动定位法国呢,今天 20:08 来自网页    ,0,bbbbbll
害怕 我也不知道自己怕什么,今天 20:08 来自网页    ,2,麻苗同学
回复 ,今天 20:08 来自网页    ,0,改了两次名的delsin咯
 你去你家楼下可别给你妈发原图,今天 20:08 来自网页    ,0,晨晨是甜心宝贝儿
会,今天 20:07 来自网页    ,0,不战败的宅青年Able
...讲道理，只要你图片有位置信息，你的原图传去哪都会有位置信息啊...原的意思不就是不作更改吗？,今天 20:07 来自网页    ,0,allenvers
我咋不知道 怎么看定位的？,今天 20:07 来自网页    ,0,啊哦俞雯
不是疑似。。。。我给npy发个照她都知道是不是今天拍的,今天 20:06 来自网页    ,0,ToshioSaeki
照片里面本来就包含位置，拍摄时间这些信息，这关微信什么事？大部分app只要发送原图，这些信息也会一并传过去，搁这带什么节奏？,今天 20:06 来自网页    ,1,追梦想的小胖子
我寻思这也要专家说？,今天 20:06 来自网页    ,0,基基基尔霍夫定律
无所谓 就算知道位置又怎样😂我发照片还经常发定位呢😂,今天 20:06 来自网页    ,0,玫莉蔻-俪慈tsang
 你上次发原图就是～,今天 20:03 来自网页    ,0,_哆啦DJ
？我是真的以为这个事是大家公认知道的啊，四五年前我还跟朋友讨论过原图怎么定位,今天 20:03 来自网页    ,0,Hello_Hell-
照片的地理信息可以不保存啊，相机设置是有选择的,今天 20:02 来自网页    ,0,自带微笑的猪
照片的地理信息可以不保存啊，相机设置是有选择的,今天 20:02 来自网页    ,0,自带微笑的猪
 ,今天 20:02 来自网页    ,0,一个莫名其妙的阿贝
关闭保存地理位置 拍的照片还是有详细经纬度的,今天 20:02 来自网页    ,0,星河清梦船满
发朋友圈会吗,今天 20:01 来自网页    ,0,s我们都辜负了爱
在互联网上谁还不是在“裸奔”呢？,今天 20:01 来自网页    ,0,枪毙名单在逃人员
微博发原图，也可以…,今天 20:01 来自网页    ,0,日常丧h
